{
  "$schema": "https://json-schema.org/draft/2020-12/schema",
  "$id": "urn:system-inspector:event:1",
  "title": "Normalised log event",
  "type": "object",
  "properties": {
    "schema_version": {
      "const": "1.0"
    },
    "event_id": {
      "type": "string",
      "pattern": "^[A-Za-z0-9][A-Za-z0-9_.:-]{0,127}$"
    },
    "project_id": {
      "type": "string",
      "pattern": "^[A-Za-z0-9][A-Za-z0-9_.:-]{0,127}$"
    },
    "process_id": {
      "type": "string",
      "pattern": "^[A-Za-z0-9][A-Za-z0-9_.:-]{0,127}$"
    },
    "server_id": {
      "type": "string",
      "pattern": "^[A-Za-z0-9][A-Za-z0-9_.:-]{0,127}$"
    },
    "process_name_snapshot": {
      "type": "string",
      "minLength": 1,
      "maxLength": 256
    },
    "server_name_snapshot": {
      "type": "string",
      "minLength": 1,
      "maxLength": 256
    },
    "raw_line": {
      "type": "string"
    },
    "timestamp_original": {
      "type": [
        "string",
        "null"
      ]
    },
    "timestamp_utc": {
      "anyOf": [
        {
          "type": "string",
          "pattern": "^\\d{4}-\\d{2}-\\d{2}T\\d{2}:\\d{2}:\\d{2}\\.\\d{6}Z$"
        },
        {
          "type": "null"
        }
      ]
    },
    "timestamp_us": {
      "type": [
        "integer",
        "null"
      ],
      "minimum": -9007199254740991,
      "maximum": 9007199254740991
    },
    "received_at": {
      "type": "string",
      "pattern": "^\\d{4}-\\d{2}-\\d{2}T\\d{2}:\\d{2}:\\d{2}\\.\\d{6}Z$"
    },
    "parse_status": {
      "enum": [
        "ok",
        "invalid_timestamp",
        "decode_error",
        "oversized_line",
        "incomplete_final_line"
      ]
    },
    "metadata": {
      "type": "object",
      "additionalProperties": {
        "type": "string"
      }
    },
    "source": {
      "type": "object",
      "properties": {
        "source_revision_id": {
          "type": "string",
          "pattern": "^[A-Za-z0-9][A-Za-z0-9_.:-]{0,127}$"
        },
        "remote_path": {
          "type": "string",
          "minLength": 2,
          "maxLength": 4096,
          "pattern": "^/[^\\u0000\\r\\n]*$"
        },
        "archive_member": {
          "type": [
            "string",
            "null"
          ]
        },
        "member_ordinal": {
          "type": [
            "integer",
            "null"
          ],
          "minimum": 0
        },
        "byte_start": {
          "type": "integer",
          "minimum": 0
        },
        "byte_end": {
          "type": "integer",
          "minimum": 0
        },
        "line_number": {
          "type": [
            "integer",
            "null"
          ],
          "minimum": 1
        },
        "content_sha256": {
          "type": "string",
          "pattern": "^[a-f0-9]{64}$"
        }
      },
      "required": [
        "source_revision_id",
        "remote_path",
        "archive_member",
        "member_ordinal",
        "byte_start",
        "byte_end",
        "line_number",
        "content_sha256"
      ],
      "additionalProperties": false
    }
  },
  "required": [
    "schema_version",
    "event_id",
    "project_id",
    "process_id",
    "server_id",
    "process_name_snapshot",
    "server_name_snapshot",
    "raw_line",
    "timestamp_original",
    "timestamp_utc",
    "timestamp_us",
    "received_at",
    "parse_status",
    "metadata",
    "source"
  ],
  "additionalProperties": false
}
